{
  "formato": "correspondentia-seme@1",
  "progetto": {
    "nome": "Calculemus",
    "argomento": "informatica",
    "sottotitolo": "atlante ipermediale dell’informatica",
    "lingua": "it",
    "descrizione": "Atlante navigabile a grafo dell’informatica come campo storico-concettuale: dalla logica alla macchina, dai linguaggi alle reti, dall’intelligenza artificiale alle sue conseguenze sociali — con le priorità contese e i miti fondativi dichiarati come tali."
  },
  "valutazione": {
    "verdetto": "idoneo",
    "criteri": {
      "entita-enumerabili": 5,
      "relazioni-tipizzabili": 5,
      "profondita-temporale": 5,
      "doppio-registro": 4,
      "letteratura-di-riferimento": 5,
      "granularita-sostenibile": 4
    },
    "note": "Perimetro scelto: storia e fondamenti dell’informatica (soglia di ingresso: la voce ha una storiografia o una letteratura tecnica canonica propria), non catalogo tecnologico: esclusi prodotti commerciali, versioni e aziende salvo rilievo strutturale. Doppio registro reale ma meno costitutivo che in campi mitopoietici: priorità contese (ENIAC/ABC/Z3), attribuzioni semplificate dalla vulgata (Colossus «di Turing», il «primo bug» di Hopper, l’eponimo di von Neumann), miti fondativi (il garage, il genio solitario). Granularità: il campo è vasto; questa prima passata fissa ~170 voci ed è pensata per crescere senza cambiare struttura."
  },
  "tassonomia": {
    "tipiNodo": [
      {
        "id": "area",
        "etichetta": "Area",
        "descrizione": "Discipline e campi di ricerca (teoria della computabilità, crittografia, IA…)"
      },
      {
        "id": "concetto",
        "etichetta": "Concetto",
        "descrizione": "Astrazioni e risultati (computabilità, complessità, ricorsione…)"
      },
      {
        "id": "algoritmo",
        "etichetta": "Algoritmo",
        "descrizione": "Procedure con nome e storia propria (Euclide, quicksort, RSA…)"
      },
      {
        "id": "linguaggio",
        "etichetta": "Linguaggio",
        "descrizione": "Linguaggi di programmazione e notazioni"
      },
      {
        "id": "sistema",
        "etichetta": "Sistema",
        "descrizione": "Macchine, software e infrastrutture (ENIAC, UNIX, Internet…)"
      },
      {
        "id": "persona",
        "etichetta": "Persona",
        "descrizione": "Figure e gruppi di lavoro"
      },
      {
        "id": "opera",
        "etichetta": "Opera",
        "descrizione": "Testi, articoli e libri fondativi"
      },
      {
        "id": "evento",
        "etichetta": "Evento",
        "descrizione": "Svolte databili (conferenze, processi, dimostrazioni)"
      },
      {
        "id": "luogo",
        "etichetta": "Luogo",
        "descrizione": "Laboratori e centri dove il campo ha preso forma"
      }
    ],
    "tipiArco": [
      {
        "id": "influenza",
        "etichetta": "influenza"
      },
      {
        "id": "deriva_da",
        "etichetta": "deriva da"
      },
      {
        "id": "si_oppone_a",
        "etichetta": "si oppone a"
      },
      {
        "id": "elabora",
        "etichetta": "elabora"
      },
      {
        "id": "implementa",
        "etichetta": "implementa"
      },
      {
        "id": "formalizza",
        "etichetta": "formalizza"
      },
      {
        "id": "contemporaneo_di",
        "etichetta": "contemporaneo di"
      },
      {
        "id": "contiene",
        "etichetta": "contiene"
      },
      {
        "id": "attribuzione_infondata",
        "etichetta": "attribuzione infondata"
      }
    ],
    "archiDerivati": [
      "contiene"
    ],
    "doppioRegistro": {
      "attivo": true,
      "tipiLeggendari": [
        "attribuzione_infondata"
      ],
      "criterio": "Priorità contese, attribuzioni semplificate dalla vulgata e miti fondativi: la relazione dichiarata dal racconto corrente esiste nel grafo, spenta di default, con nota obbligatoria che riporta ciò che la storiografia documenta."
    }
  },
  "parti": [
    {
      "numero": 1,
      "id": "parte-1-fondamenti",
      "titolo": "Fondamenti",
      "sommario": "Logica, computabilità e informazione: come una domanda sulla matematica (che cosa è calcolabile?) generò la macchina universale e la misura dell’informazione."
    },
    {
      "numero": 2,
      "id": "parte-2-macchine",
      "titolo": "Macchine",
      "sommario": "Dal telaio di Jacquard al microprocessore: la storia materiale del calcolo, con le sue priorità contese e i suoi progetti dimenticati."
    },
    {
      "numero": 3,
      "id": "parte-3-linguaggi",
      "titolo": "Linguaggi e astrazioni",
      "sommario": "Come si è imparato a parlare alle macchine: linguaggi, paradigmi, compilatori e l’arte di costruire astrazioni sopra astrazioni."
    },
    {
      "numero": 4,
      "id": "parte-4-algoritmi",
      "titolo": "Algoritmi e complessità",
      "sommario": "Le procedure con nome e storia, la misura del loro costo, i limiti di ciò che si può calcolare in tempo utile — e la crittografia che su quei limiti si fonda."
    },
    {
      "numero": 5,
      "id": "parte-5-sistemi-e-reti",
      "titolo": "Sistemi e reti",
      "sommario": "I sistemi operativi, le basi di dati, l’ingegneria del software e la rete delle reti: come i calcolatori impararono a convivere e a parlarsi."
    },
    {
      "numero": 6,
      "id": "parte-6-intelligenza-e-societa",
      "titolo": "Intelligenza e società",
      "sommario": "L’intelligenza artificiale fra promesse e inverni, il personal computer, le culture del software e le conseguenze sociali dell’informatica."
    }
  ],
  "regole": {
    "guardrail": [
      "Le priorità contese (ENIAC/ABC/Z3, paternità di idee e macchine) sono presentate come contese, mai risolte d’ufficio in un solo «inventore».",
      "Vulgate e miti fondativi (il garage, il genio solitario, il «primo bug») vengono raccontati e marcati come tali, con ciò che la storiografia documenta.",
      "Le figure cancellate dal racconto corrente (le programmatrici dell’ENIAC, Tommy Flowers, i contributi collettivi) sono restituite alla storia.",
      "Crittografia e sicurezza si descrivono storicamente e concettualmente: nessuna istruzione operativa per attacchi o esfiltrazioni.",
      "Distinguere sempre il risultato matematico dalla sua vulgata: le affermazioni di impossibilità citano il teorema e il suo enunciato reale.",
      "Ogni voce cita in calce letteratura reale (storiografia dell’informatica o testi tecnici canonici); nessuna fonte inventata."
    ],
    "lunghezze": {
      "1": [
        120,
        250
      ],
      "2": [
        150,
        300
      ],
      "3": [
        200,
        400
      ],
      "4": [
        250,
        600
      ],
      "5": [
        400,
        1500
      ]
    },
    "fontiMinime": 1
  },
  "voci": [
    {
      "id": "leibniz",
      "titolo": "Gottfried Wilhelm Leibniz",
      "tipo": "persona",
      "parte": 1,
      "peso": 3,
      "sommario": "Il filosofo che sognò di ridurre il ragionamento a calcolo («calculemus») e progettò una macchina moltiplicatrice: il programma intellettuale dell’informatica, due secoli in anticipo sui mezzi.",
      "periodo": {
        "da": 1646,
        "a": 1716
      },
      "archi": [
        {
          "verso": "logica-booleana",
          "tipo": "influenza",
          "nota": "La characteristica universalis come antenato del calcolo logico"
        },
        {
          "verso": "logica-matematica",
          "tipo": "influenza"
        },
        {
          "verso": "babbage",
          "tipo": "influenza",
          "nota": "La macchina moltiplicatrice come precedente dichiarato"
        }
      ],
      "fonti": [
        "Davis, The Universal Computer"
      ]
    },
    {
      "id": "boole",
      "titolo": "George Boole",
      "tipo": "persona",
      "parte": 1,
      "peso": 4,
      "sommario": "Ridusse la logica ad algebra: le sue «leggi del pensiero» diventeranno, un secolo dopo, il linguaggio dei circuiti.",
      "periodo": {
        "da": 1815,
        "a": 1864
      },
      "archi": [
        {
          "verso": "logica-booleana",
          "tipo": "elabora",
          "nota": "L’algebra della logica nelle Laws of Thought (1854)"
        },
        {
          "verso": "logica-matematica",
          "tipo": "influenza"
        }
      ],
      "fonti": [
        "Davis, The Universal Computer",
        "Gleick, The Information"
      ]
    },
    {
      "id": "hilbert",
      "titolo": "David Hilbert",
      "tipo": "persona",
      "parte": 1,
      "peso": 3,
      "sommario": "Il matematico che chiese se esista un procedimento meccanico per decidere ogni enunciato (Entscheidungsproblem): la domanda sbagliata che generò le risposte giuste — Gödel, Church, Turing.",
      "periodo": {
        "da": 1862,
        "a": 1943
      },
      "archi": [
        {
          "verso": "godel",
          "tipo": "influenza",
          "nota": "Il programma formalista è il bersaglio dei teoremi di incompletezza"
        },
        {
          "verso": "computabilita",
          "tipo": "influenza",
          "nota": "L’Entscheidungsproblem costringe a definire che cosa sia un procedimento effettivo"
        }
      ],
      "fonti": [
        "Davis, The Universal Computer"
      ]
    },
    {
      "id": "godel",
      "titolo": "Kurt Gödel",
      "tipo": "persona",
      "parte": 1,
      "peso": 4,
      "sommario": "I teoremi di incompletezza (1931) mostrarono i limiti dei sistemi formali e fornirono la tecnica — l’aritmetizzazione — con cui Turing costruirà l’indecidibilità della fermata.",
      "periodo": {
        "da": 1906,
        "a": 1978
      },
      "luoghi": [
        "ias-princeton"
      ],
      "archi": [
        {
          "verso": "turing",
          "tipo": "influenza",
          "nota": "Aritmetizzazione e autoriferimento passano nel lavoro del 1936"
        },
        {
          "verso": "logica-matematica",